,idmb_id,Remarks,SentimentScore Military,OverallSentiment Military,SentimentScore Army,OverallSentiment Army,SentimentScore AirForce,OverallSentiment AirForce,SentimentScore Navy,OverallSentiment Navy,SentimentScore War,OverallSentiment War,SentimentScore Marine,OverallSentiment Marine
319,tt0603538,"production company requested use of marine corps air ground combat center, 29 palms, ca, for one day shoot with tanks. depiction of marines reasonably accurate with extreme comedic license and very positive. formal approval 15mar1995.","[0.15025927, 0.02965648, 0.8200843]",2,"[0.31763515, 0.07912965, 0.6032352]",2,"[0.066954724, 0.016143566, 0.9169017]",2,"[0.055742715, 0.017937737, 0.92631954]",2,"[0.76005805, 0.031672884, 0.20826906]",0,"[0.05521884, 0.01089565, 0.9338855]",2
320,tt0603426,"production company requested filming aboard uss constellation pierside for one day for season opener in which actor tim allen brings tool time to visit the ship. positive depictions, if comedic. approved request.","[0.23124367, 0.14235231, 0.626404]",2,"[0.25579846, 0.5919222, 0.15227933]",1,"[0.18726039, 0.19195631, 0.62078327]",2,"[0.17687327, 0.16858366, 0.65454304]",2,"[0.37716714, 0.16638902, 0.45644385]",2,"[0.16750054, 0.12574913, 0.70675033]",2
321,tt0041481,story of world war ii abuse of black soldier by white soldiers during a special mission. assistance not requested. controversial at time.,"[0.08002099, 0.8447362, 0.07524281]",1,"[0.09171454, 0.8328261, 0.0754594]",1,"[0.21305904, 0.6001309, 0.18681008]",1,"[0.10563405, 0.8120455, 0.08232043]",1,"[0.1582555, 0.75762665, 0.08411786]",1,"[0.20725, 0.59570843, 0.1970416]",1
322,tt0097521,stock footage was approved for an air force jet flying over a desert terrain.,"[0.7964161, 0.11626865, 0.08731514]",0,"[0.6710776, 0.2817941, 0.0471283]",0,"[0.8422094, 0.048861206, 0.10892941]",0,"[0.6753774, 0.14394799, 0.18067458]",0,"[0.92817354, 0.05628233, 0.015544136]",0,"[0.8474718, 0.09928365, 0.05324465]",0
323,tt0104437,"the request for dod assistance came in from the producer. there followed a period of negotiation, while dod attempted to remove the depiction of military helicopter pilots following the murderous orders of a civilian scientist bad guy. however, dod ability to influence the script went away when it was informed that its assistance was no longer required.","[0.6046809, 0.3612463, 0.034072842]",0,"[0.51052463, 0.4643062, 0.0251692]",0,"[0.5183893, 0.43287957, 0.048731126]",0,"[0.529988, 0.42806336, 0.041948695]",0,"[0.7824358, 0.20613813, 0.011426074]",0,"[0.52852863, 0.44903496, 0.02243642]",0
324,tt0102059,parody of top gun,"[0.14281468, 0.8209444, 0.036240846]",1,"[0.09833856, 0.8852334, 0.01642804]",1,"[0.08681955, 0.8734614, 0.039719075]",1,"[0.05003182, 0.93583506, 0.0141330855]",1,"[0.6206801, 0.31802776, 0.061292175]",0,"[0.08093196, 0.89663666, 0.022431431]",1
325,tt0051750,big budget film about jet fighters in korea and their battles with soviet migs. air force provided planes used in spectacular flying sequences and provided gun camera stock footage.,"[0.019004209, 0.010969884, 0.9700259]",2,"[0.08491993, 0.051466007, 0.8636141]",2,"[0.0036915073, 0.0015566532, 0.9947519]",2,"[0.016286233, 0.008350046, 0.97536373]",2,"[0.52741325, 0.0093611935, 0.46322554]",0,"[0.0942629, 0.058320265, 0.8474168]",2
326,tt0053440,"army wanted film made to show how it was developing its missiles and how it had put the first satellite into orbit. film becomes a biography of wernher von braun, showing his nazi origins and rehabilitation as american hero. much controversy. nasa refused to cooperate because it did not want to be associated with man who built rockets which hit london uncharitably subtitled by some critics: but sometimes i hit london. army gave full assistance.","[0.5716381, 0.087031916, 0.34133]",0,"[0.55962616, 0.060421094, 0.37995276]",0,"[0.5356301, 0.2247691, 0.23960087]",0,"[0.57887423, 0.24014267, 0.18098311]",0,"[0.834747, 0.12816776, 0.03708528]",0,"[0.6175014, 0.24081333, 0.1416853]",0
327,tt0480249,"approved filming night exterior in nyc near brooklyn bridge. involved army stryker armored vehicles supplied with crews from contractor because no others were available, humvees, black hawk helicopter, and approximately 80 soldiers as extras, all these from the ny national guard.","[0.793738, 0.18586117, 0.020400869]",0,"[0.81334794, 0.16609056, 0.020561567]",0,"[0.7237575, 0.22830652, 0.047936]",0,"[0.7274436, 0.25630817, 0.016248284]",0,"[0.93029743, 0.06222603, 0.007476536]",0,"[0.7166064, 0.26871336, 0.014680292]",0
328,tt0033741,"army air corps preparedness film. focus on training of new pilots. stale plot, but air corps provided lots of planes and aerial scenes including the new bs.","[0.32899615, 0.30064282, 0.370361]",2,"[0.4464806, 0.1366699, 0.41684946]",0,"[0.32100412, 0.07396461, 0.60503125]",2,"[0.3108439, 0.3678146, 0.3213415]",1,"[0.83533335, 0.09066836, 0.07399821]",0,"[0.38007322, 0.12606156, 0.49386522]",2
329,tt0063121,"navy provided full cooperation, use of nuclear submarine, etc. for a misguided cold war confrontation film. u.s. and russian forces face off in artic over spy satellite photos that have fallen near research station.","[0.016213324, 0.005000336, 0.97878635]",2,"[0.43956086, 0.05534641, 0.5050928]",2,"[0.38308516, 0.04224925, 0.57466555]",2,"[0.001263831, 0.0010955266, 0.99764067]",2,"[0.7005232, 0.2807643, 0.018712472]",0,"[0.35448936, 0.052995697, 0.592515]",2
330,tt0097570,"air force approval after earlier don baruch turndown, 19jul1988 the army and the air force concurred on providing assistance for the film, after it was understood by the production the rules and regulations of the department","[0.8469402, 0.023107892, 0.1299519]",0,"[0.69206744, 0.0076818424, 0.30025074]",0,"[0.22867824, 0.008745209, 0.7625765]",2,"[0.8162874, 0.031570964, 0.15214166]",0,"[0.92171365, 0.055615406, 0.02267095]",0,"[0.8814995, 0.025780015, 0.09272045]",0
331,tt0088892,"dod felt there was nothing positive for the department or for the army since the film concerned the army.no connection to norman jewison film, which see.","[0.33311415, 0.6291714, 0.037714478]",1,"[0.76912946, 0.15803567, 0.07283494]",0,"[0.15672274, 0.8190663, 0.024211021]",1,"[0.16318741, 0.80683637, 0.02997627]",1,"[0.56450194, 0.41768184, 0.017816221]",0,"[0.2552073, 0.7247817, 0.020011013]",1
332,tt0059309,"otto preminger began his movie in pearl harbor on december 7, 1941. stocked film with john wayne, kurt douglas. film positive, but contains inaccurate portrayals including paratroop marines. wayne goes on mission even though he knew battle plan. later loses leg, but stays in service due td regulations. navy provided ships and locales, but battle takes place with models","[0.48804867, 0.491072, 0.020879317]",1,"[0.5923622, 0.3916962, 0.015941503]",0,"[0.5622077, 0.40058297, 0.03720937]",0,"[0.3864123, 0.40721864, 0.2063691]",1,"[0.92442715, 0.061818667, 0.013754155]",0,"[0.4287591, 0.54119545, 0.030045416]",1
333,tt0051770,army provided limited assistance in world war ii film showing effect of war on three soldiers. some men and equipment in background,"[0.12101084, 0.84166425, 0.037324917]",1,"[0.11340254, 0.81943196, 0.06716548]",1,"[0.47025174, 0.486393, 0.04335525]",1,"[0.15268579, 0.80217844, 0.045135792]",1,"[0.93211716, 0.052048873, 0.015833989]",0,"[0.81261116, 0.1712093, 0.016179569]",0
334,tt0093249,"approved not all the requests, only the request for stock footage. problem was admiral stockdale's claim that no north vietnam ships attacked the american destroyer in tonkin gulf. contrary to official policy. footage given because of stockdale's heroism and reputation, but no other help. file in suid collection, georgetown university library","[0.32851905, 0.6460478, 0.025433261]",1,"[0.2141895, 0.76956314, 0.016247291]",1,"[0.26405713, 0.69452614, 0.04141679]",1,"[0.45224696, 0.46458185, 0.08317119]",1,"[0.5084225, 0.46627387, 0.025303658]",0,"[0.36469215, 0.5988606, 0.03644726]",1
335,tt0110123,"pauly shore comedy in which he becomes an army reserve water purification specialist and winds up being recalled to active duty. company requested use of army reserve site, helicopters, vehicles, extras, for production.","[0.92234933, 0.05363103, 0.024019651]",0,"[0.9306279, 0.034714784, 0.03465739]",0,"[0.8525197, 0.12642018, 0.021060087]",0,"[0.8670361, 0.114937305, 0.018026562]",0,"[0.88055587, 0.111295305, 0.00814886]",0,"[0.8798942, 0.103649385, 0.016456407]",0
336,tt0107205,"company requested use of camp gruber, a national guard training facility in oklahoma, to double as fort hood, where actual pre assault training took place; also requested use of national guard helicopters to reenact pre assault observation sequence. approved assistance based on strong encouragement from fbi or atf, who said series is positive an reasonably accurate. very supportive to law enforcement. depiction of military accurate; picture ends with ill fated assault.","[0.0040125423, 0.0047329445, 0.9912545]",2,"[0.010632218, 0.007937048, 0.9814307]",2,"[0.35124123, 0.19213118, 0.45662767]",2,"[0.3378929, 0.20926854, 0.45283857]",2,"[0.6781703, 0.26088703, 0.060942627]",0,"[0.4568683, 0.26232472, 0.280807]",0
337,tt0104500,"after the utah state film commission forwarded the script, dod determined that the request for a uhh helicopter would be declined due to an inaccurate scene and the possibility of competition between dod and a private industry.","[0.14139864, 0.8400055, 0.018595899]",1,"[0.114597045, 0.8712629, 0.014140076]",1,"[0.21043107, 0.73487157, 0.054697406]",1,"[0.18981364, 0.76948804, 0.040698346]",1,"[0.25922, 0.72216564, 0.018614396]",1,"[0.11338136, 0.87405545, 0.012563229]",1
338,tt0107206,"essentially a secret service picture. service is cooperating, and military is depicted positively if minimally. authorized filming at military installations and of military people bl aircraft during presidential arrivals and departures, etc","[0.01377379, 0.0057216976, 0.9805045]",2,"[0.2274255, 0.059084933, 0.7134896]",2,"[0.6093109, 0.13616808, 0.254521]",0,"[0.2554629, 0.108930945, 0.63560617]",2,"[0.92602473, 0.02519778, 0.048777483]",0,"[0.7143785, 0.111435205, 0.17418636]",0
339,tt0084132,"army, navy, and marines approved project. much assistance provided. may 4 was premiere at the kennedy center. reviewed on may 6.","[0.90808433, 0.006797816, 0.08511791]",0,"[0.78712416, 0.0073783533, 0.20549752]",0,"[0.9454272, 0.0074027674, 0.047169983]",0,"[0.35392463, 0.006789504, 0.63928586]",2,"[0.9913381, 0.0040115723, 0.004650349]",0,"[0.9654728, 0.0046091652, 0.029918024]",0
340,tt0099842,"the film was denied by the army for several reasons. they found it to be highly implausible. brutal, and misleading. the production company didn't have enough time to make all the appropriate changes for dod.","[0.028511003, 0.95938754, 0.012101476]",1,"[0.013733787, 0.9811909, 0.005075305]",1,"[0.051168773, 0.9157278, 0.033103447]",1,"[0.067068785, 0.9056932, 0.027238093]",1,"[0.089917615, 0.88703954, 0.02304284]",1,"[0.033830993, 0.95281714, 0.013351916]",1
341,tt0116629,"no cooperation due to implausible portrayal of military and story centered on aliens attacking from space and anemic u.s. military response. on or about 1995, became obvious that the company was going to go its own way and make picture without us. no formal letter from dod.","[0.25322008, 0.7067982, 0.03998173]",1,"[0.4472411, 0.51378566, 0.03897316]",1,"[0.5880611, 0.36301947, 0.04891944]",0,"[0.55651766, 0.40638164, 0.0371007]",0,"[0.9091752, 0.08235493, 0.008469871]",0,"[0.40976113, 0.5754573, 0.014781636]",1
342,tt0097576,the navy and the department offered limited assistance to the production. they approved of the use of the naval station treasure island's administration building as a 1930'5 style backdrop.,"[0.42461103, 0.34018162, 0.23520736]",0,"[0.2839654, 0.652641, 0.063393556]",1,"[0.42851347, 0.46183652, 0.109649986]",1,"[0.33697176, 0.27921742, 0.38381085]",2,"[0.67945546, 0.2253144, 0.09523014]",0,"[0.52343583, 0.32586455, 0.1506996]",0
343,tt0104516,"inaccurate depictions of operations, security, procedures, missions, declined use of lockheed stock footage of fa.","[0.0067546535, 0.98590785, 0.0073374826]",1,"[0.011643498, 0.98206294, 0.0062935874]",1,"[0.057689995, 0.849592, 0.092718005]",1,"[0.009589004, 0.98175955, 0.008651475]",1,"[0.046209242, 0.9262887, 0.027502086]",1,"[0.019585675, 0.94508594, 0.035328377]",1
344,tt0095376,the film was denied. it was very negative for the u.s. army. it left the viewer misleading and false impressions of what happened with the army in vietnam,"[0.09368741, 0.81421214, 0.09210043]",1,"[0.4418983, 0.30216312, 0.25593862]",0,"[0.054745667, 0.9086414, 0.036612958]",1,"[0.102019176, 0.85269076, 0.0452901]",1,"[0.49817088, 0.46420422, 0.037624888]",0,"[0.030238546, 0.9543815, 0.015379905]",1
345,tt0091276,"the film was approved by the department and the services. it presented a positive image to a large section of the recruiting age market. the thesis of cooperating with sci fi invasions is that the service, in this case the marines, would oppose the advanced society. this is the remake of the 1950's classic. the marines provided full cooperation, since film showed corps doing its job. documents in suid collection, georgetown university library.","[0.6419316, 0.10914993, 0.24891849]",0,"[0.6108125, 0.2835049, 0.10568265]",0,"[0.5421582, 0.36837682, 0.089465]",0,"[0.56969523, 0.15677041, 0.27353436]",0,"[0.75722927, 0.17616037, 0.066610396]",0,"[0.76469207, 0.03086117, 0.2044467]",0
346,tt0089348,"approved with no additional cost to the government beneficial to the national guard, as well as to the entire department. film, but shows army doing its job. documents in georgetown university collection.","[0.85935575, 0.01206673, 0.12857752]",0,"[0.73910654, 0.009279433, 0.2516141]",0,"[0.81712294, 0.04064076, 0.14223632]",0,"[0.8512423, 0.022784183, 0.1259735]",0,"[0.9452698, 0.01742376, 0.03730646]",0,"[0.88265985, 0.016460387, 0.1008798]",0
347,tt0103617,"the department denied all requests of approval. the film contradicted u.s. government policy. the film failed to depict military people and events accurately, and would not benefit recruiting or retention.","[0.10972115, 0.85135895, 0.038919903]",1,"[0.07107552, 0.9075085, 0.021416035]",1,"[0.049020078, 0.92915136, 0.021828515]",1,"[0.040023457, 0.9465799, 0.013396651]",1,"[0.4009082, 0.5641245, 0.03496735]",1,"[0.024976823, 0.967527, 0.0074961553]",1
348,tt0371746,"approved filming at edwards air force base, ca, mainly on the flight line with non flying c, f, and global hawk aircraft, vehicles, and military extras as background. marine corps area at edwards also used.","[0.9453338, 0.032166187, 0.022500055]",0,"[0.8249521, 0.09914001, 0.075907916]",0,"[0.6644841, 0.10044195, 0.23507395]",0,"[0.79243463, 0.050086807, 0.1574786]",0,"[0.87574184, 0.10237966, 0.021878544]",0,"[0.7380603, 0.023920702, 0.238019]",0
349,tt1228705,"most of the military scenes were also filmed at edwards. from a technical standpoint we provided unclassified technological specs, set up research trips to air force bases, and gave the visual effects department access so they could meticulously and accurately reflect realistic aircraft markings on the war machine character. the air force assisted in designing the war machine markings and featured the 412th flight test center. approximately 200 airmen from edwards, and 26 from los angeles air force bases were used as extras for filming. airmen played a variety of roles to include flight operations and aircraft maintenance and tower personnel. in addition, 26 airmen from laafb participated as extras for a closing ceremony scene featured at the end of the film.","[0.9226257, 0.044709776, 0.032664564]",0,"[0.7898545, 0.1907669, 0.019378603]",0,"[0.8492633, 0.044925444, 0.10581123]",0,"[0.79055655, 0.17779605, 0.0316474]",0,"[0.8864876, 0.09796373, 0.015548647]",0,"[0.90849197, 0.07326715, 0.018240893]",0
350,tt0097593,"the request for stock footage was approved by the air force and by mr. d. baruch on may 24. the army disapproved on may 23, unless the executions were omitted","[0.5735616, 0.30340996, 0.12302844]",0,"[0.03154275, 0.9604269, 0.008030355]",1,"[0.099091925, 0.0052233716, 0.8956847]",2,"[0.6583042, 0.22613677, 0.11555899]",0,"[0.89652884, 0.06478589, 0.038685247]",0,"[0.6954176, 0.23411521, 0.070467256]",0
351,tt0119395,approved use of aircraft and filming locations after production company changed fbi sniper to marine sniper and increased scope of marine depictions. production company used marine ch for fast roping sequence film principally depicts fbi in a positive light.,"[0.36403236, 0.5302077, 0.10575996]",1,"[0.23851071, 0.70941556, 0.05207372]",1,"[0.37172222, 0.3069185, 0.32135925]",0,"[0.29262918, 0.6158893, 0.091481484]",1,"[0.6682148, 0.22591999, 0.105865255]",0,"[0.48978698, 0.24746712, 0.26274586]",0
352,tt0097607,"the air national guard, the air force, and the dod approved and assisted in the filming at no extra cost to the government.","[0.11172867, 0.0112518985, 0.87701946]",2,"[0.369453, 0.040615413, 0.5899316]",2,"[0.013310053, 0.0025130075, 0.984177]",2,"[0.14028645, 0.021703716, 0.8380098]",2,"[0.7212216, 0.043679353, 0.23509906]",0,"[0.1988376, 0.023670085, 0.77749234]",2
353,tt0112022,"questionable whether or not production company formally requested assistance, but the navy never formally declined assistance, although clearly the production was not supportable due to inaccuracies, etc. however, after saav met with producer, it was agreed to attempt to provide assistance on an episode by episode basis.","[0.61328036, 0.33519155, 0.05152805]",0,"[0.40009758, 0.5730149, 0.026887536]",1,"[0.5571871, 0.36550316, 0.07730981]",0,"[0.04028905, 0.9362455, 0.023465402]",1,"[0.87797385, 0.106370784, 0.015655397]",0,"[0.53397065, 0.42276016, 0.043269116]",0
354,tt0613353,navy authorized with dod concurrence stock footage for this episode,"[0.85017896, 0.090910204, 0.058910806]",0,"[0.8021655, 0.15116736, 0.046667125]",0,"[0.76733553, 0.100107044, 0.13255742]",0,"[0.78780854, 0.027279759, 0.18491176]",0,"[0.77689075, 0.20263352, 0.020475656]",0,"[0.8163505, 0.15541925, 0.028230298]",0
355,tt0613297,"production company requested to film around a marine corps hangar plus some marines depicting navy personnel. script ok, not very realistic, but overall positive. navy posed no objection, marines wanted to provide assistance   positive. new marine character is marine jag officer. assistance modest.","[0.04117203, 0.017845603, 0.94098234]",2,"[0.09649613, 0.048805464, 0.8546984]",2,"[0.045326304, 0.029369837, 0.9253039]",2,"[0.047096472, 0.014869535, 0.938034]",2,"[0.17442787, 0.07758566, 0.74798644]",2,"[0.05361624, 0.021046346, 0.92533743]",2
356,tt0613200,authorized one day of filming at van nuys airport with usmc ch. reasonably accurate depiction of anti terrorism scene.,"[0.28105605, 0.030200416, 0.68874353]",2,"[0.5638162, 0.08332718, 0.3528566]",0,"[0.19223098, 0.034114808, 0.7736542]",2,"[0.32071847, 0.089724846, 0.5895567]",2,"[0.49982816, 0.044112433, 0.45605943]",0,"[0.034261808, 0.0063330345, 0.9594052]",2
357,tt0613206,"approved filming at nas pt mugu ca for one day, includes use of hangars and non flying aircraft as set dressing; story silly as usual but positive","[0.39057422, 0.41432518, 0.19510067]",1,"[0.21524423, 0.7344061, 0.050349634]",1,"[0.33399728, 0.34737688, 0.31862584]",1,"[0.30018893, 0.4779882, 0.2218229]",1,"[0.5415, 0.25492617, 0.20357384]",0,"[0.33138096, 0.5640642, 0.104554825]",1
358,tt0613300,"approved filming of two episodes this one and rules of engagement aboard uss stennis for three days routine filming aboard ship, ongoing flight ops, interiors or exteriors cnn and other media will also embark.","[0.9205359, 0.06877083, 0.010693301]",0,"[0.78609526, 0.20358829, 0.010316416]",0,"[0.9030843, 0.07755894, 0.019356774]",0,"[0.9099585, 0.07086437, 0.019177187]",0,"[0.9757297, 0.019770047, 0.004500319]",0,"[0.940953, 0.04975325, 0.009293752]",0
359,tt0613345,"approved filming of two episodes this one and king of the greenie board aboard uss stennis for several days filming to include routine int or ext shots and ongoing flight ops considerable media will also embark, including cnn.","[0.96655715, 0.02882328, 0.0046195975]",0,"[0.9008441, 0.09320487, 0.0059509883]",0,"[0.94940895, 0.041218366, 0.009372716]",0,"[0.931247, 0.05931327, 0.009439791]",0,"[0.9852962, 0.0124689415, 0.0022348634]",0,"[0.9736372, 0.022535995, 0.0038268357]",0
360,tt0613310,"approved filming for one day in and around a hangar at naval weapons station point mugu, ca.","[0.96748227, 0.025653098, 0.00686458]",0,"[0.92959666, 0.06443556, 0.005967852]",0,"[0.7930626, 0.01699978, 0.18993756]",0,"[0.9796371, 0.011079727, 0.009283167]",0,"[0.9875547, 0.009019657, 0.0034256247]",0,"[0.9816166, 0.0066208434, 0.011762584]",0
361,tt0613271,"approved filming with static aircraft as background at naval air weapons station, point mugu, ca, for one day","[0.858405, 0.12475204, 0.016842999]",0,"[0.78822654, 0.20215604, 0.009617429]",0,"[0.8369766, 0.1164348, 0.04658854]",0,"[0.8751335, 0.09188374, 0.03298277]",0,"[0.984288, 0.011065844, 0.0046461714]",0,"[0.93022436, 0.048374183, 0.021401485]",0
362,tt0613337,"approved filming for one day at the navy or marine corps reserve center, encino, ca.","[0.9462762, 0.015608375, 0.038115412]",0,"[0.8937352, 0.07543476, 0.030830113]",0,"[0.7937203, 0.060694747, 0.14558496]",0,"[0.54365677, 0.010836282, 0.4455069]",0,"[0.97154725, 0.022165421, 0.0062873815]",0,"[0.9315461, 0.011062615, 0.057391297]",0
363,tt0613294,"approved filming for one evening september 19 at nas pt mugu, ca, involving the use of an exterior bridge area","[0.9125227, 0.07886861, 0.0086087035]",0,"[0.83308923, 0.15829986, 0.008610915]",0,"[0.90154254, 0.08649527, 0.011962158]",0,"[0.80971634, 0.1771443, 0.013139371]",0,"[0.9583052, 0.03634286, 0.0053520105]",0,"[0.97694963, 0.013776849, 0.009273558]",0
364,tt0613263,approved filming aboard the self defense test ship at port hueneme sea bee base.,"[0.89850676, 0.012515618, 0.088977665]",0,"[0.91267705, 0.036144167, 0.05117882]",0,"[0.7005075, 0.028610703, 0.27088177]",0,"[0.81135523, 0.028688645, 0.15995611]",0,"[0.96739364, 0.012374355, 0.020232067]",0,"[0.86928135, 0.008972175, 0.12174649]",0
365,tt0613262,"approved filming on august 31 and september 1 at nas pt mugu, california. filming involved use of flight line locations and off duty military personnel as extras.","[0.98774767, 0.004543825, 0.007708522]",0,"[0.9823446, 0.008939787, 0.008715536]",0,"[0.9749553, 0.020027194, 0.0050174096]",0,"[0.96994275, 0.024942704, 0.0051145474]",0,"[0.9897222, 0.008887626, 0.0013901029]",0,"[0.9886158, 0.006706632, 0.00467757]",0
366,tt0613378,"approved filming for one day at port hueneme, ca, involving the use of the navy pier areas.","[0.9423591, 0.0478951, 0.009745824]",0,"[0.8603235, 0.12872918, 0.01094737]",0,"[0.8831824, 0.065854795, 0.050962787]",0,"[0.9064518, 0.023664154, 0.069884025]",0,"[0.9802706, 0.01275159, 0.006977823]",0,"[0.9745299, 0.011377816, 0.014092267]",0
367,tt0613304,"approved filming for one day at port hueneme, ca, involving the use of navy pier areas.","[0.943776, 0.046910156, 0.009313824]",0,"[0.8744771, 0.11457428, 0.010948564]",0,"[0.8681208, 0.035091817, 0.096787445]",0,"[0.9436818, 0.012758051, 0.043560196]",0,"[0.98062325, 0.011735538, 0.007641177]",0,"[0.9715162, 0.014028229, 0.014455538]",0
368,tt0613298,"approved filming for one day at naval air station point mugu, ca, to include navy extras off duty and use of flight line locations.","[0.9581239, 0.016880913, 0.024995156]",0,"[0.9108145, 0.07071728, 0.018468179]",0,"[0.91968834, 0.054596595, 0.025715044]",0,"[0.9418531, 0.008811329, 0.049335595]",0,"[0.9763089, 0.01852093, 0.0051702047]",0,"[0.9606714, 0.026343955, 0.0129846325]",0
369,tt0613386,"approved filming for one day at the officers club at naval base port heuneme, ca, and the flight line at naval air station point mugu, ca. off duty military volunteers served as background extras.","[0.35845342, 0.012242988, 0.62930363]",2,"[0.89713496, 0.015912747, 0.08695221]",0,"[0.9474789, 0.027105873, 0.025415245]",0,"[0.9319372, 0.013036925, 0.055025868]",0,"[0.9888281, 0.0061188526, 0.0050530364]",0,"[0.95438325, 0.010419786, 0.035196975]",0
370,tt0613291,"approved filming for one day at the flight line of naval air station point mugu, ca. static aircraft and off duty military volunteers served as background.","[0.7781741, 0.007109933, 0.21471593]",0,"[0.8156026, 0.008553737, 0.17584364]",0,"[0.96033335, 0.015864074, 0.023802593]",0,"[0.92045045, 0.008322943, 0.0712266]",0,"[0.98732555, 0.0043393318, 0.008335132]",0,"[0.9331722, 0.0056776265, 0.061150126]",0
371,tt0613414,"approved filming for one day at naval. air station point mugu, ca. typically modest support, background equipment, hangar, volunteer, off duty extras.","[0.010945419, 0.0018168342, 0.98723775]",2,"[0.112835154, 0.013348502, 0.8738164]",2,"[0.04564761, 0.006409049, 0.9479434]",2,"[0.20306246, 0.009007595, 0.78792995]",2,"[0.15291472, 0.01254457, 0.8345407]",2,"[0.024907399, 0.003436624, 0.97165596]",2
372,tt0613392,"approved filming for one day at naval air station point mugu, california, involving interior and exterior sites in the flight line vicinity. approximately 3d off duty sailors performed as extras.","[0.9812177, 0.011740178, 0.0070421617]",0,"[0.89408743, 0.098544195, 0.007368424]",0,"[0.93664986, 0.055549588, 0.007800489]",0,"[0.9670979, 0.026829572, 0.0060726097]",0,"[0.9744958, 0.022845507, 0.0026586473]",0,"[0.9831872, 0.009897358, 0.0069154515]",0
