,idmb_id,Remarks,SentimentScore Military,OverallSentiment Military,SentimentScore Army,OverallSentiment Army,SentimentScore AirForce,OverallSentiment AirForce,SentimentScore Navy,OverallSentiment Navy,SentimentScore War,OverallSentiment War,SentimentScore Marine,OverallSentiment Marine
530,tt0028216,"interesting story of cooperation. director w.s van dyke was a marine reserve officer. needed extras who could obey split second orders during climactic earthquake and obtained permission to use active duty marines in scenes of destruction, etc","[0.62954855, 0.32194504, 0.048506405]",0,"[0.4187355, 0.55945987, 0.021804668]",1,"[0.64063734, 0.297791, 0.061571665]",0,"[0.59296215, 0.36624423, 0.040793646]",0,"[0.8938085, 0.0885257, 0.0176658]",0,"[0.76410365, 0.16318697, 0.07270939]",0
531,tt0041841,classic marine film which created john waynes image of the american fighting man. marines provided full cooperation at camp pendleton to restage assaults on tarawa and iwo jima. only problem related to scene in which john wayne hits one of his men with rifle butt during traning. technical advisor objected to scene and bucked it up to commandant's office which confirmed original approval. but scene toned down and humored up. wayne dies after teaching the next generation. film credited by marines with aiding recruitment,"[0.28627485, 0.4189769, 0.2947483]",1,"[0.49173692, 0.2663944, 0.24186866]",0,"[0.19493982, 0.7082528, 0.09680739]",1,"[0.13866328, 0.2027809, 0.65855587]",2,"[0.14884654, 0.6334648, 0.21768868]",1,"[0.045082, 0.13404, 0.820878]",2
532,tt0377112,"approved relatively modest assistance: two days of filming with national guard uh black hawk in el paso area; filming in dallas area with tactical and combat vehicles tx army national guard also, plus a non flying usmc c positioned at navy managed carswell joint reserve base as background. original script was wildly unrealistic, as were early news reports. but as official information became public especially the offical army report of the 507th capture, the filmmakers radically altered the script to make it reasonably realistic.","[0.20194088, 0.77567935, 0.022379803]",1,"[0.7784758, 0.16329217, 0.058232043]",0,"[0.12488213, 0.8527629, 0.02235494]",1,"[0.49429592, 0.4486288, 0.05707527]",0,"[0.49649614, 0.48239484, 0.021108935]",0,"[0.21855009, 0.7653603, 0.0160897]",1
533,tt0120815,army office in la critiqued script and pointed out technical errors including reality that the pentagon could not have learn ed two days after d day that two ryan brothers had died on dday. army had no equipment dating from world war ii. spielberg used irish army for landings and subsequent scenes shot in england,"[0.7623443, 0.21154086, 0.026114812]",0,"[0.87514484, 0.07139775, 0.053457387]",0,"[0.6748303, 0.30145273, 0.023716982]",0,"[0.77174413, 0.21503761, 0.013218312]",0,"[0.91371775, 0.0796411, 0.006641196]",0,"[0.67810535, 0.30929214, 0.012602549]",0
534,tt0050933,"air force initially reluctant to provide assistance because of inter racial dating and suicide of one of its enlisted men. ultimately, provided planes and equipment","[0.13869755, 0.07580867, 0.7854938]",2,"[0.20078833, 0.06910247, 0.73010916]",2,"[0.06141734, 0.16894385, 0.7696388]",2,"[0.18573809, 0.192916, 0.62134594]",2,"[0.783448, 0.057733465, 0.1588186]",0,"[0.21557882, 0.10494572, 0.6794755]",2
535,tt0088146,dod felt this film might give the audience background and insight on the beginning of integration in the armed forces. request for filming on fort chaffee proved to be beneficial to dod.,"[0.116244234, 0.021018868, 0.8627369]",2,"[0.24830864, 0.044589087, 0.7071023]",2,"[0.26397476, 0.0707819, 0.6652433]",2,"[0.11928183, 0.035451293, 0.8452668]",2,"[0.78443545, 0.048902187, 0.16666228]",0,"[0.36067495, 0.07940531, 0.5599198]",2
536,tt0102879,the army allowed use of walter reed army hospital after two slight inaccuracies were corrected. beneficial to the army and the department,"[0.005101483, 0.001754698, 0.9931438]",2,"[0.0068561817, 0.0018098853, 0.99133396]",2,"[0.020248579, 0.0052780434, 0.9744734]",2,"[0.0105917165, 0.0030862226, 0.98632205]",2,"[0.0075167464, 0.0033196672, 0.98916364]",2,"[0.007528229, 0.005258336, 0.98721343]",2
537,tt0034167,classic pre world war ii preparedness film about hero of world war i. pro intervention propaganda. army provided some help in staging combat sequences,"[0.0038316487, 0.0015357906, 0.9946326]",2,"[0.0027805828, 0.0012515356, 0.99596786]",2,"[0.06622557, 0.013711441, 0.920063]",2,"[0.004962207, 0.0017536702, 0.9932841]",2,"[0.65748423, 0.046922073, 0.29559368]",0,"[0.041133553, 0.010611113, 0.94825536]",2
538,tt0058576,"the pentagon denied all assistance in light of story of chairman of the joint chiefs of staff planning a coup because president signed a disarmament treaty. however, filmmakers talked their way aboard an aircraft carrier in san diego to obtain shots to create ambiance of carrier. producer admitted but claimed navy should have informed all ships not to let him aboard and said he was only helping director.","[0.34366864, 0.64014703, 0.01618431]",1,"[0.40533906, 0.58356386, 0.011097154]",1,"[0.33914113, 0.64039207, 0.020466814]",1,"[0.02879298, 0.9630284, 0.008178674]",1,"[0.86175555, 0.13072558, 0.0075188954]",0,"[0.3833935, 0.60363483, 0.012971699]",1
539,tt0117608,"never received formal request. but saav personally told imagine entertainment co owner brian glazer hopeless, and ocpa la told universal executive andy given and imagine entertainment executive that it is hopeless. completely negative, inaccurate. impossible to alter by any means other than total rewrite and completely new film.","[0.019172758, 0.96728325, 0.013544016]",1,"[0.015889803, 0.973945, 0.010165177]",1,"[0.03019444, 0.9412075, 0.028598055]",1,"[0.017978445, 0.9493692, 0.03265236]",1,"[0.122058176, 0.8486304, 0.02931144]",1,"[0.036342327, 0.9479699, 0.015687786]",1
540,tt1236414,dod and the air force felt the film would be positive for them both. all requests were granted. ,"[0.00997593, 0.0022331185, 0.98779094]",2,"[0.04330417, 0.01024887, 0.94644696]",2,"[0.0040266644, 0.0015943652, 0.994379]",2,"[0.0072003766, 0.002001927, 0.99079764]",2,"[0.268613, 0.02350141, 0.7078856]",2,"[0.0063584903, 0.0022171324, 0.9914244]",2
541,tt0105391,the department and the air force released some wwii stock footage to the production for release,"[0.9513006, 0.027478114, 0.021221273]",0,"[0.9063051, 0.07209897, 0.021595955]",0,"[0.9105468, 0.016445935, 0.073007256]",0,"[0.87958515, 0.04665044, 0.073764354]",0,"[0.9655879, 0.02166722, 0.012744805]",0,"[0.9234664, 0.06313001, 0.013403611]",0
542,tt0022376,"first sound movie made at the naval academy. typical romance with songs. full cooperation with parades, campus, etc","[0.05710909, 0.0111468015, 0.93174416]",2,"[0.34024146, 0.07325127, 0.5865073]",2,"[0.24942584, 0.09987414, 0.6507001]",2,"[0.025655871, 0.0040909685, 0.97025317]",2,"[0.6654443, 0.020456932, 0.31409878]",0,"[0.024902858, 0.005433856, 0.9696633]",2
543,tt0026988,"another in series of naval academy films during the 1935. same parades, scenic campus, etc. popularity probably arose from escapism during depression","[0.6704407, 0.24878511, 0.08077417]",0,"[0.43844756, 0.54627043, 0.015282045]",1,"[0.538226, 0.41203284, 0.04974118]",0,"[0.73105204, 0.06072089, 0.20822708]",0,"[0.89544874, 0.06053546, 0.04401584]",0,"[0.68027574, 0.1383836, 0.18134072]",0
544,tt0100606,the department provided courtesy assistance to the production. they provided authorization for off duty marines being used in an opening parade sequence. they were on leave status and the script brought no discredit to the corps.,"[0.23776993, 0.67777574, 0.08445435]",1,"[0.19252746, 0.7679337, 0.039538812]",1,"[0.28009772, 0.5952577, 0.124644585]",1,"[0.2267153, 0.66642153, 0.10686313]",1,"[0.3561102, 0.6274052, 0.016484635]",1,"[0.60416853, 0.33212435, 0.0637072]",0
545,tt0081930,dod found nothing objectionable about the script and assisted with use of some stock footage.,"[0.511051, 0.042674556, 0.4462745]",0,"[0.45266345, 0.12534958, 0.421987]",0,"[0.45743787, 0.09910068, 0.44346145]",0,"[0.30442208, 0.09369527, 0.6018827]",2,"[0.8807034, 0.083358735, 0.035937887]",0,"[0.45820498, 0.049750526, 0.49204457]",2
546,tt0108160,"production company requested use of navy hangar in washington state, seattle area, for use as a production facility. considering hangar will soon be turned over to the state, we agreed, although there is no military theme to the picture at all.","[0.17802644, 0.80160797, 0.020365607]",1,"[0.37951753, 0.57713896, 0.043343574]",1,"[0.50353354, 0.45564967, 0.04081676]",0,"[0.8049628, 0.071887426, 0.12314977]",0,"[0.80152464, 0.16681707, 0.0316583]",0,"[0.44342616, 0.52854604, 0.028027745]",1
547,tt0052225,"the marines and the navy provided men and equipment for the musical. both services did have some problems with the story and images, but overlooked them because of the genre","[0.39667475, 0.33082953, 0.27249575]",0,"[0.3061444, 0.55217284, 0.14168274]",1,"[0.15004413, 0.7339117, 0.11604423]",1,"[0.079904325, 0.009530689, 0.910565]",2,"[0.54753375, 0.33136845, 0.12109778]",0,"[0.32782322, 0.42453384, 0.24764292]",1
548,tt0083111,"after some hesitation, the louisiana national guard provided men and a helicopter for filming a non vietnam, vietnam story about a national guard unit that goes into the bayous for weekend training and encounter cajun natives. when the unit steals some canoes, the natives start picking off the national guardsmen. the filmmakers acknowledged that the movie was a parable for vietnam","[0.5413068, 0.43322065, 0.02547256]",0,"[0.5123407, 0.47198623, 0.015673077]",0,"[0.5753753, 0.36497542, 0.059649304]",0,"[0.45466852, 0.49643713, 0.04889436]",1,"[0.76439255, 0.22700585, 0.008601594]",0,"[0.64147687, 0.33923042, 0.019292785]",0
549,tt0088611,approved and to the best interest of all the services,"[0.004913254, 0.004815306, 0.99027145]",2,"[0.0618414, 0.09223893, 0.84591967]",2,"[0.029492758, 0.03432769, 0.9361796]",2,"[0.0031384283, 0.0041786986, 0.9926829]",2,"[0.14242089, 0.1448078, 0.71277136]",2,"[0.06999316, 0.08675286, 0.84325397]",2
550,tt0086350,"the film was felt to be misleading to the public regarding controls over nuclear weapons, the security of materials critical to the manufacturer of nuclear weapons and the capabilities of dod.","[0.08663105, 0.9018347, 0.011534184]",1,"[0.06535891, 0.92621017, 0.008430843]",1,"[0.11389909, 0.8639079, 0.022192959]",1,"[0.04593238, 0.9459565, 0.008111139]",1,"[0.44945377, 0.52683717, 0.023709117]",1,"[0.08325858, 0.90606016, 0.010681252]",1
551,tt0108941,"requested use of military equipment and installations for abc tv miniseries based on stephen king novel of same name. letter from production manager read, in part, that the producer hoped that the nature of the story, which depicted the army accidentally releasing a gas that almost kills everyone in america, would not deter the dod from favorably considering his request for assistance. declined assistance.","[0.60984516, 0.37702698, 0.013127833]",0,"[0.6385501, 0.3389928, 0.022457106]",0,"[0.5276095, 0.39127505, 0.081115484]",0,"[0.489289, 0.48962197, 0.021089086]",1,"[0.7849884, 0.18756936, 0.027442265]",0,"[0.4149021, 0.55878454, 0.026313411]",1
552,tt0794369,"film was shot with full marine corps cooperation at the marine barracks in bremerton, washington. the marines provided the location, marines as extras, and equipment for a rite of passage story of a half english, half american teenager whose mother marries a marine colonel and he comes to stay, learning about both the marines and american history. when the u.s. enters world war i, the boy puts the union jack and star spangled banner together to symbolize the new alliance","[0.6540305, 0.2578119, 0.088157564]",0,"[0.6147045, 0.34299406, 0.04230143]",0,"[0.6594437, 0.2903827, 0.05017364]",0,"[0.5884117, 0.28841153, 0.12317678]",0,"[0.9250493, 0.008517021, 0.06643366]",0,"[0.078935124, 0.023730664, 0.8973342]",2
553,tt0092007,approved us of navy's u.s.s. ranger. in the best interest of the department. navy had some concern about enterprise crew members getting into secure locations until reminded that a transporter would deliver crew and so not be a security violation,"[0.14645916, 0.8221034, 0.03143746]",1,"[0.08657165, 0.9010565, 0.01237184]",1,"[0.18779781, 0.7494417, 0.062760465]",1,"[0.33974224, 0.44486308, 0.21539469]",1,"[0.253153, 0.7280541, 0.018792875]",1,"[0.09858933, 0.88622826, 0.015182456]",1
554,tt0120844,"production company requested use of inactive titan missile silo with missile under custody of pima air museum, arizona. other than usaf on missile, no military depiction.","[0.29553944, 0.69341403, 0.011046533]",1,"[0.42031196, 0.56385136, 0.015836734]",1,"[0.4735352, 0.5009676, 0.02549721]",1,"[0.48301816, 0.5004102, 0.016571632]",1,"[0.75761694, 0.23355909, 0.008824026]",0,"[0.44873407, 0.5367973, 0.014468688]",1
555,tt0118480,"production company requested to film exterior of entrance to cheyenne mountain complex for title sequence. as the scripts incorporated considerable input from usaf, approved request","[0.8181804, 0.14009859, 0.04172103]",0,"[0.67174566, 0.29461622, 0.03363817]",0,"[0.7487377, 0.17538008, 0.07588218]",0,"[0.66653013, 0.2702639, 0.06320598]",0,"[0.82476383, 0.15135124, 0.023884982]",0,"[0.86333436, 0.079719335, 0.05694625]",0
556,tt0088172,"there was nothing of positive nature for services, especially the air force. approval was denied. as often the case with sci fi pictures, the military became the villian trying to capture the nice alien and dissect him or something like that.","[0.104780115, 0.8872285, 0.007991345]",1,"[0.17153534, 0.81948084, 0.008983848]",1,"[0.13576551, 0.33091003, 0.53332454]",2,"[0.1862891, 0.7983611, 0.015349728]",1,"[0.86670166, 0.12278322, 0.010515171]",0,"[0.5052353, 0.45095402, 0.043810703]",0
557,tt0096169,dod and the ngb found the film to be blatantly anti iraqi and not in consonance with our current policy toward the country.,"[0.10410644, 0.8772293, 0.0186643]",1,"[0.1018897, 0.88422245, 0.013887911]",1,"[0.15368803, 0.7988078, 0.047504183]",1,"[0.09684107, 0.8823881, 0.020770777]",1,"[0.7511458, 0.21933094, 0.029523307]",0,"[0.078288585, 0.90675807, 0.014953349]",1
558,tt0382992,nan,"[0.8739641, 0.08930188, 0.036734086]",0,"[0.664096, 0.2833473, 0.05255669]",0,"[0.54252875, 0.11701194, 0.34045935]",0,"[0.3847775, 0.5105789, 0.10464366]",1,"[0.93653953, 0.03276093, 0.030699542]",0,"[0.7395539, 0.17405401, 0.08639205]",0
559,tt0038120,"movie based on writing of ernie pyle and his covering of the italian campaign. the army provided a unit to serve as extras and equipment during filming. afterwards, the unit went to the pacific and suffered significant casualties. considered one of the great war movies of all time. ","[0.4467728, 0.15340447, 0.39982268]",0,"[0.38762474, 0.17178242, 0.44059286]",2,"[0.27719593, 0.4884864, 0.23431766]",1,"[0.25622392, 0.609497, 0.13427906]",1,"[0.0010097367, 0.0011671548, 0.9978231]",2,"[0.3254572, 0.57463926, 0.09990359]",1
560,tt0086374,assistance was denied by the department after being reviewed by the united states air force. a lot of false and inappropriate information about the air force was contained in the film.,"[0.049778134, 0.9421314, 0.008090478]",1,"[0.045885254, 0.9451056, 0.009009088]",1,"[0.45411634, 0.3158267, 0.23005694]",0,"[0.12719624, 0.830395, 0.042408742]",1,"[0.29686204, 0.6880026, 0.015135419]",1,"[0.04526153, 0.9472151, 0.0075234408]",1
561,tt0048667,"classic cold war movie about the strategic air command and its mission. jimmy stewart plays a baseball player recalled to active duty to fly b's. film made with assistance of curtis lemay and the air force which provided men, equipment, and most important, airplanes including the newly delivered b. the filmmakers desire to film close order takeoffs caused major damage to the jet engines as the planes taxied in close order. hundreds of thousands of dollars had to be spent on repairs. not reimbursed. but great benefit to sac.","[0.12995154, 0.095588334, 0.77446014]",2,"[0.28719202, 0.33829173, 0.37451628]",2,"[0.075253084, 0.0372965, 0.8874504]",2,"[0.09568827, 0.08249838, 0.82181334]",2,"[0.0061798645, 0.003076574, 0.9907436]",2,"[0.19712098, 0.20569916, 0.5971799]",2
562,tt0083131,"patton family opposed production for years. ultimately frank mccarthy, who had served as secretary to general george marshall during war, prevailed on army to give blessings pointing out he only wanted to portray public life of patton which was a matter of public record. family apparently concerned about patton's relationship with his niece. army actually provided very little assistance since it had no world war ii equipment left. film actually shot in spain with spanish equipment.","[0.21371557, 0.72091734, 0.06536708]",1,"[0.5760793, 0.37013304, 0.053787686]",0,"[0.32572082, 0.6133662, 0.06091297]",1,"[0.39158496, 0.5746123, 0.033802755]",1,"[0.96830845, 0.019953243, 0.011738331]",0,"[0.28437927, 0.6982503, 0.017370472]",1
563,tt0019434,"this was first major submarine movie. really about a navy diver who ultimately dives on submarine sunk in an accident. despite images of accident, suffocating sailors, and an unfaithful navy wife, the navy provided a submarine, equipment, and navy men and divers.","[0.51232827, 0.18211582, 0.30555594]",0,"[0.46659836, 0.39617577, 0.13722585]",0,"[0.4622846, 0.34494606, 0.19276935]",0,"[0.20650528, 0.07794446, 0.71555024]",2,"[0.633365, 0.25906092, 0.10757409]",0,"[0.5184473, 0.17868492, 0.3028678]",0
564,tt0044085,"story starts at end of world war ii, but mostly set in korean theater even though submarines actually had virtually no role in war. however, navy provided a submarine for exterior shots","[0.5976955, 0.3533646, 0.048939902]",0,"[0.47340035, 0.5031207, 0.023478927]",1,"[0.5575093, 0.36345607, 0.07903462]",0,"[0.51127815, 0.2165582, 0.27216363]",0,"[0.8764176, 0.11087616, 0.012706325]",0,"[0.6361468, 0.31585371, 0.0479995]",0
565,tt0029617,sub marine disaster movie which showed navy's development of mccann diving bell to rescue sailors from sunken submarines. became almost prophetic since bell was used to rescue men from the squalus. filming at submarine base in new london.,"[0.155369, 0.82727367, 0.017357368]",1,"[0.16165017, 0.8251794, 0.013170474]",1,"[0.2217223, 0.7439907, 0.03428698]",1,"[0.19576362, 0.74755174, 0.056684684]",1,"[0.3283817, 0.6550388, 0.016579563]",1,"[0.13347131, 0.84611845, 0.020410296]",1
566,tt0006115,"navy loaned charlie chaplin's brother syndey a submarine in the making of a silly comedy. however, navy liked film so much, it bought two copies to use as a recruiting tool. approved assistance, date approximate. film at library of congress","[0.105936654, 0.047956876, 0.84610647]",2,"[0.4281553, 0.27385914, 0.29798552]",0,"[0.2577951, 0.12218351, 0.6200214]",2,"[0.005045921, 0.0025771994, 0.99237686]",2,"[0.21698125, 0.106893405, 0.6761254]",2,"[0.24371146, 0.10768169, 0.6486069]",2
567,tt0100998,no benefit to the dod. the film had an inaccurate portrayal of u.s. and other countries' policies. the request for stock footage was denied,"[0.017204193, 0.9779587, 0.0048371847]",1,"[0.013117693, 0.9830575, 0.0038248291]",1,"[0.02467046, 0.96680844, 0.008521133]",1,"[0.016461493, 0.9774016, 0.006136893]",1,"[0.16286282, 0.82862824, 0.008508985]",1,"[0.020292036, 0.9751865, 0.0045214565]",1
568,tt3263904,"usaf support to this project took place at holloman afb, nm, in december 2015. support for this project was one full day of shooting f phantoms. the phantoms that were shot were capable of being piloted remotely or with people, as they are actually used as aerial targets real drones but in this case they were shot while being manually piloted. only a handful of airmen were used as background extras. director clint eastwood was present for the day of filming. the featured f underwent an exterior paint job to reflect a historically accurate paint scheme from the vietnam era. aerial shots of two fs were also accomplished via a commercial learjet","[0.5716432, 0.4007591, 0.02759767]",0,"[0.41787842, 0.5646599, 0.017461712]",1,"[0.5464547, 0.41629615, 0.037249118]",0,"[0.35984945, 0.6077335, 0.032417055]",1,"[0.92664874, 0.06510999, 0.00824132]",0,"[0.6208212, 0.35668257, 0.022496251]",0
569,tt0164184,"requested permission to film the naoc aircraft in flight during a routine refueling by a kc for aerial sequences; requested airforce for permission to film b and f aircraft while in flight, in ground taxi and take off activities as well. in addition, producers requested and dod approved filming near montreal, canada with two marine corps ch and two army ch helicopters, army disaster relief equipment, as well as military extras. there was a second filming unit in san diego, ca that did film additional military sequences as well.","[0.9439965, 0.012987307, 0.043016206]",0,"[0.8987411, 0.02596242, 0.07529647]",0,"[0.8126175, 0.105602026, 0.081780516]",0,"[0.8680564, 0.085111685, 0.046831902]",0,"[0.90033805, 0.08337014, 0.0162918]",0,"[0.9088546, 0.038680978, 0.052464448]",0
570,tt0090098,denied: not in the best interest of the department.,"[0.08469319, 0.89714223, 0.018164586]",1,"[0.075311765, 0.9029023, 0.02178589]",1,"[0.10221148, 0.8520506, 0.045737915]",1,"[0.086073294, 0.8747844, 0.039142285]",1,"[0.2974255, 0.6621162, 0.040458318]",1,"[0.08730858, 0.89323676, 0.019454634]",1
571,tt0078350,approved and found to be mutually beneficial to the department of defense. the use of helicopters was also granted.,"[0.016572634, 0.003162923, 0.9802644]",2,"[0.040609475, 0.008565727, 0.9508248]",2,"[0.016027126, 0.00355366, 0.9804192]",2,"[0.009166476, 0.0021842835, 0.98864925]",2,"[0.27344283, 0.012054638, 0.7145026]",2,"[0.009103293, 0.003007343, 0.98788935]",2
572,tt0046398,"film about infantry basic training at fort bliss with full army cooperation. originally written about marine basic training at parris island, but marines refused to cooperate because of recent training accidents. went all the way to commandant for final decision","[0.04151843, 0.014496286, 0.9439853]",2,"[0.0015108824, 0.0012599984, 0.99722916]",2,"[0.52773166, 0.13008864, 0.34217978]",0,"[0.3773861, 0.11286932, 0.5097446]",2,"[0.9223762, 0.05162501, 0.025998801]",0,"[0.28513104, 0.06737432, 0.6474947]",2
573,tt1019454,"very little actual production support some minor equipment borrowed from the 512th memorial affairs squadron, dover afb, de. mostly provided staffing services, obtaining approval for research at dover, etc. this was a feature length picture produced by hbo, starring kevin bacon.","[0.5958001, 0.37558874, 0.028611168]",0,"[0.38882256, 0.5952059, 0.015971607]",1,"[0.41751167, 0.5443285, 0.038159862]",1,"[0.38387132, 0.5872217, 0.028906971]",1,"[0.8699688, 0.11915409, 0.01087714]",0,"[0.5196129, 0.46808547, 0.012301658]",0
574,tt0088224,"after considerable discussions and changes in script, dod felt the end result would be beneficial for the army and the production.","[0.18090495, 0.016600119, 0.80249494]",2,"[0.00976482, 0.0023919444, 0.9878433]",2,"[0.34427255, 0.101487905, 0.5542395]",2,"[0.4905228, 0.24602836, 0.2634489]",0,"[0.768555, 0.07638166, 0.15506335]",0,"[0.5563505, 0.07436731, 0.36928216]",0
575,tt0114614,requested use of missile silo for nonmilitary mad max type of story did not meet dod criteria fdr support.,"[0.044863917, 0.88807774, 0.0670583]",1,"[0.033441316, 0.947288, 0.019270722]",1,"[0.059082847, 0.88672525, 0.054191917]",1,"[0.04281137, 0.9268154, 0.030373225]",1,"[0.057831574, 0.9202216, 0.021946806]",1,"[0.018181255, 0.95992184, 0.021896945]",1
576,tt0083169,"approved assistance after resolving several inaccuracies in the film, and an earlier turn down by the dod. revised script ended up with a film that was supported by the department and the ngb. positive impression for the ngb. provided good impression for the moviegoers.","[0.437253, 0.20284982, 0.35989723]",0,"[0.3084565, 0.48435947, 0.20718399]",1,"[0.20460075, 0.20721218, 0.5881871]",2,"[0.09325638, 0.09195263, 0.81479096]",2,"[0.22606722, 0.19801857, 0.5759142]",2,"[0.3299553, 0.23313773, 0.43690693]",2
577,tt0044108,"story of american fliers shot down over occupied france, captured, interrogated, and escape to send message of where to bomb to hit gasoline tanks before invasion. only film to feature b bombers in world war ii action","[0.31531265, 0.450699, 0.23398834]",1,"[0.32512212, 0.5796969, 0.09518098]",1,"[0.28024653, 0.23362947, 0.4861241]",2,"[0.33713213, 0.45828655, 0.2045813]",1,"[0.58502454, 0.03131696, 0.38365853]",0,"[0.35525823, 0.22729711, 0.41744465]",2
578,tt0041948,"the navy's epic of the development of aircraft carrier warfare, from the original flights off the uss langley to the creation of the modern, post wwii 40,000 ton carriers. gary cooper is the hero who takes part in all developments. climax is fictionalized account of the uss franklin's survival as the most damaged ship in wwii. script originally written and approved in 1945. project in limbo for three years until studio thought story could find market. spectacular combat sequences. shipboard scenes shot during a cruise.","[0.059933506, 0.18333504, 0.7567315]",2,"[0.21160483, 0.4867841, 0.3016111]",1,"[0.09208081, 0.25018215, 0.657737]",2,"[0.0018699636, 0.0019068953, 0.99622315]",2,"[0.009605942, 0.01657825, 0.9738158]",2,"[0.04144344, 0.115117215, 0.84343934]",2
